start,end,key_title,question
423.6,462.0,Court Jurisdiction in the United States:Here is the summary of the key points in markdown format:->Jurisdiction:->Types of Jurisdiction:->In Rem Jurisdiction:->Definition: Whether a court has the power to decide cases concerning a specific property:Let me know if you'd like me to clarify or expand on any of these points!,"Here are 5 multiple-choice questions based on the given information:

1. What does REM stand for in the context of jurisdiction?
A) Right to Enforce Matters
B) Relevant Estate Matters
C) Real Estate Matters
D) Relevant Estate Management

Correct answer: C) Real Estate Matters

2. Which court is likely to have jurisdiction over a property located in California?
A) New York Court
B) California Court
C) Federal Court
D) International Court

Correct answer: B) California Court

3. What does REM jurisdiction ask about?
A) The power of a court to decide cases
B) The location of a property
C) The value of a property
D) The ownership of a property

Correct answer: A) The power of a court to decide cases

4. Which of the following courts may not have jurisdiction over a property located in California?
A) California Court
B) New York Court
C) Federal Court
D) International Court

Correct answer: B) New York Court

5. What does REM jurisdiction determine?
A) The value of a property
B) The ownership of a property
C) The power of a court to decide cases
D) The location of a property

Correct answer: C) The power of a court to decide cases"
32.62,64.66,Court Jurisdiction in the United States:Here is the summary of the key points in markdown format:->Jurisdiction:->Types of Jurisdiction:->Subject Matter Jurisdiction:->Definition: Whether a court has jurisdiction over the subject matter of a case:,"Here are 5 multiple-choice questions based on the given information:

1. What is the first basic aspect of jurisdiction?
A) Personal jurisdiction
B) Subject matter jurisdiction
C) Venue jurisdiction
D) Jurisdiction over parties

Correct answer: B) Subject matter jurisdiction

2. What does subject matter jurisdiction refer to?
A) Whether a court has jurisdiction over the parties involved in a case
B) Whether a court has jurisdiction over the subject matter of a case
C) Whether a court has jurisdiction over the location of a case
D) Whether a court has jurisdiction over the type of dispute

Correct answer: B) Whether a court has jurisdiction over the subject matter of a case

3. Which court has jurisdiction over patent disputes?
A) U.S. Bankruptcy Court
B) U.S. Patent Court
C) U.S. District Court
D) U.S. Supreme Court

Correct answer: B) U.S. Patent Court

4. What type of dispute does the U.S. Patent Court NOT have jurisdiction over?
A) Divorce proceedings
B) Patent disputes
C) Contract disputes
D) Intellectual property disputes

Correct answer: A) Divorce proceedings

5. What is the purpose of subject matter jurisdiction?
A) To determine whether a court has jurisdiction over the parties involved in a case
B) To determine whether a court has jurisdiction over the subject matter of a case
C) To determine whether a court has jurisdiction over the location of a case
D) To determine whether a court has jurisdiction over the type of dispute

Correct answer: B) To determine whether a court has jurisdiction over the subject matter of a case"
64.66,132.5,Court Jurisdiction in the United States:Here is the summary of the key points in markdown format:->Jurisdiction:->Types of Jurisdiction:->Personal Jurisdiction:->Definition: Whether a court has jurisdiction over a specific person or organization as the defendant in a case:,"Here are 5 multiple-choice questions based on the given information:

1. What type of jurisdiction does a criminal law court NOT have over civil matters?
A) Subject matter jurisdiction
B) Personal jurisdiction
C) Jurisdiction over criminal cases
D) Jurisdiction over civil cases

Correct answer: C) Jurisdiction over criminal cases

2. What is required for a court to have jurisdiction over a case?
A) Only subject matter jurisdiction
B) Only personal jurisdiction
C) Both subject matter jurisdiction and personal jurisdiction
D) Neither subject matter jurisdiction nor personal jurisdiction

Correct answer: C) Both subject matter jurisdiction and personal jurisdiction

3. Which of the following courts typically has jurisdiction over a defendant who resides in the same state?
A) Court in a different state
B) Court in the same state
C) Court in a neighboring state
D) Court in a foreign country

Correct answer: B) Court in the same state

4. What are the two main principles that the doctrine of personal jurisdiction is grounded on?
A) Courts should protect defendants from the burden of facing litigation in an unlimited jurisdiction, and courts should protect plaintiffs from the burden of facing a defendant who is not present in the court.
B) Courts should protect defendants from the burden of facing litigation in an unlimited jurisdiction, and courts should protect defendants from the burden of facing a defendant who is not present in the court.
C) Courts should protect defendants from the burden of facing litigation in an unlimited jurisdiction, and courts should protect plaintiffs from the burden of facing a defendant who is not present in the court.
D) Courts should protect defendants from the burden of facing litigation in an unlimited jurisdiction, and courts should protect defendants from the burden of facing a defendant who is not present in the court.

Correct answer: B) Courts should protect defendants from the burden of facing litigation in an unlimited jurisdiction, and courts should protect defendants from the burden of facing a defendant who is not present in the court.

5. What is the doctrine of personal jurisdiction grounded on?
A) Two main principles
B) Three main principles
C) Four main principles
D) Five main principles

Correct answer: A) Two main principles"
462.0,495.12,"Court Jurisdiction in the United States:Here is the summary of the key points in markdown format:->Jurisdiction:->Types of Jurisdiction:->Personal Jurisdiction:->Guiding Principles: Protect defendants from the burden of facing litigation in an unlimited number of possibly remote jurisdictions, and prevent states from infringing on the sovereignty of other states:","Here are 5 multiple-choice questions based on the given information:

Question 1: Where can the tenant sue the landlord if they have a slip and fall in their apartment due to a puddle of water in the lobby?

A) Only in New York
B) Only in Connecticut
C) In either New York or Connecticut
D) Nowhere

Correct answer: C) In either New York or Connecticut

Question 2: Why can the tenant sue the landlord in Connecticut?

A) Because the landlord resides in New York
B) Because the landlord resides in Connecticut
C) Because the landlord is doing business in Connecticut
D) Because the landlord is doing business in New York

Correct answer: B) Because the landlord resides in Connecticut

Question 3: Why can the tenant sue the landlord in New York?

A) Because the landlord resides in New York
B) Because the landlord resides in Connecticut
C) Because the landlord is doing business in New York
D) Because the landlord is doing business in Connecticut

Correct answer: C) Because the landlord is doing business in New York

Question 4: What type of jurisdiction allows the tenant to sue the landlord in Connecticut?

A) Subjective jurisdiction
B) Objective jurisdiction
C) Personal jurisdiction
D) Subjective jurisdiction

Correct answer: C) Personal jurisdiction

Question 5: What is the reason for the tenant's broken leg?

A) The landlord's negligence
B) The tenant's own fault
C) The landlord's business in New York
D) The landlord's residence in Connecticut

Correct answer: A) The landlord's negligence"
